[
    {
        "testId":  "agent-command-bar",
        "occurrences":  16,
        "surfaces":  [
                         "build.main",
                         "dialog.add.microsoft-iq",
                         "dialog.add-connected-agent",
                         "dialog.add-knowledge",
                         "dialog.add-knowledge.advanced",
                         "dialog.add-mcp-server",
                         "dialog.add-skill.blank",
                         "dialog.add-skill.upload",
                         "dialog.add-tool",
                         "dialog.settings.agent-details",
                         "dialog.settings.ai-behavior",
                         "dialog.settings.greeting-prompts",
                         "dialog.settings.safety-access",
                         "evaluate.main",
                         "monitor.main",
                         "preview.main"
                     ],
        "surfaceCount":  16,
        "isShared":  true,
        "tags":  [
                     "header"
                 ],
        "roles":  [

                  ],
        "anyInteractive":  false,
        "sampleLabel":  "Agent toolbar"
    },
    {
        "testId":  "agent-command-bar.feedback",
        "occurrences":  16,
        "surfaces":  [
                         "build.main",
                         "dialog.add.microsoft-iq",
                         "dialog.add-connected-agent",
                         "dialog.add-knowledge",
                         "dialog.add-knowledge.advanced",
                         "dialog.add-mcp-server",
                         "dialog.add-skill.blank",
                         "dialog.add-skill.upload",
                         "dialog.add-tool",
                         "dialog.settings.agent-details",
                         "dialog.settings.ai-behavior",
                         "dialog.settings.greeting-prompts",
                         "dialog.settings.safety-access",
                         "evaluate.main",
                         "monitor.main",
                         "preview.main"
                     ],
        "surfaceCount":  16,
        "isShared":  true,
        "tags":  [
                     "button"
                 ],
        "roles":  [

                  ],
        "anyInteractive":  true,
        "sampleLabel":  "Send feedback"
    },
    {
        "testId":  "agent-command-bar.overflow-trigger",
        "occurrences":  16,
        "surfaces":  [
                         "build.main",
                         "dialog.add.microsoft-iq",
                         "dialog.add-connected-agent",
                         "dialog.add-knowledge",
                         "dialog.add-knowledge.advanced",
                         "dialog.add-mcp-server",
                         "dialog.add-skill.blank",
                         "dialog.add-skill.upload",
                         "dialog.add-tool",
                         "dialog.settings.agent-details",
                         "dialog.settings.ai-behavior",
                         "dialog.settings.greeting-prompts",
                         "dialog.settings.safety-access",
                         "evaluate.main",
                         "monitor.main",
                         "preview.main"
                     ],
        "surfaceCount":  16,
        "isShared":  true,
        "tags":  [
                     "button"
                 ],
        "roles":  [

                  ],
        "anyInteractive":  true,
        "sampleLabel":  "More options"
    },
    {
        "testId":  "agent-command-bar.publish-button",
        "occurrences":  16,
        "surfaces":  [
                         "build.main",
                         "dialog.add.microsoft-iq",
                         "dialog.add-connected-agent",
                         "dialog.add-knowledge",
                         "dialog.add-knowledge.advanced",
                         "dialog.add-mcp-server",
                         "dialog.add-skill.blank",
                         "dialog.add-skill.upload",
                         "dialog.add-tool",
                         "dialog.settings.agent-details",
                         "dialog.settings.ai-behavior",
                         "dialog.settings.greeting-prompts",
                         "dialog.settings.safety-access",
                         "evaluate.main",
                         "monitor.main",
                         "preview.main"
                     ],
        "surfaceCount":  16,
        "isShared":  true,
        "tags":  [
                     "button"
                 ],
        "roles":  [

                  ],
        "anyInteractive":  true,
        "sampleLabel":  "Publish"
    },
    {
        "testId":  "agent-command-bar.publish-split-chevron",
        "occurrences":  16,
        "surfaces":  [
                         "build.main",
                         "dialog.add.microsoft-iq",
                         "dialog.add-connected-agent",
                         "dialog.add-knowledge",
                         "dialog.add-knowledge.advanced",
                         "dialog.add-mcp-server",
                         "dialog.add-skill.blank",
                         "dialog.add-skill.upload",
                         "dialog.add-tool",
                         "dialog.settings.agent-details",
                         "dialog.settings.ai-behavior",
                         "dialog.settings.greeting-prompts",
                         "dialog.settings.safety-access",
                         "evaluate.main",
                         "monitor.main",
                         "preview.main"
                     ],
        "surfaceCount":  16,
        "isShared":  true,
        "tags":  [
                     "button"
                 ],
        "roles":  [

                  ],
        "anyInteractive":  true,
        "sampleLabel":  "Customize publish channels"
    },
    {
        "testId":  "agent-command-bar.save-button",
        "occurrences":  16,
        "surfaces":  [
                         "build.main",
                         "dialog.add.microsoft-iq",
                         "dialog.add-connected-agent",
                         "dialog.add-knowledge",
                         "dialog.add-knowledge.advanced",
                         "dialog.add-mcp-server",
                         "dialog.add-skill.blank",
                         "dialog.add-skill.upload",
                         "dialog.add-tool",
                         "dialog.settings.agent-details",
                         "dialog.settings.ai-behavior",
                         "dialog.settings.greeting-prompts",
                         "dialog.settings.safety-access",
                         "evaluate.main",
                         "monitor.main",
                         "preview.main"
                     ],
        "surfaceCount":  16,
        "isShared":  true,
        "tags":  [
                     "button"
                 ],
        "roles":  [

                  ],
        "anyInteractive":  true,
        "sampleLabel":  "Save"
    },
    {
        "testId":  "agent-command-bar.share-button",
        "occurrences":  16,
        "surfaces":  [
                         "build.main",
                         "dialog.add.microsoft-iq",
                         "dialog.add-connected-agent",
                         "dialog.add-knowledge",
                         "dialog.add-knowledge.advanced",
                         "dialog.add-mcp-server",
                         "dialog.add-skill.blank",
                         "dialog.add-skill.upload",
                         "dialog.add-tool",
                         "dialog.settings.agent-details",
                         "dialog.settings.ai-behavior",
                         "dialog.settings.greeting-prompts",
                         "dialog.settings.safety-access",
                         "evaluate.main",
                         "monitor.main",
                         "preview.main"
                     ],
        "surfaceCount":  16,
        "isShared":  true,
        "tags":  [
                     "button"
                 ],
        "roles":  [

                  ],
        "anyInteractive":  true,
        "sampleLabel":  "Share"
    },
    {
        "testId":  "agent-command-bar.tabs",
        "occurrences":  16,
        "surfaces":  [
                         "build.main",
                         "dialog.add.microsoft-iq",
                         "dialog.add-connected-agent",
                         "dialog.add-knowledge",
                         "dialog.add-knowledge.advanced",
                         "dialog.add-mcp-server",
                         "dialog.add-skill.blank",
                         "dialog.add-skill.upload",
                         "dialog.add-tool",
                         "dialog.settings.agent-details",
                         "dialog.settings.ai-behavior",
                         "dialog.settings.greeting-prompts",
                         "dialog.settings.safety-access",
                         "evaluate.main",
                         "monitor.main",
                         "preview.main"
                     ],
        "surfaceCount":  16,
        "isShared":  true,
        "tags":  [
                     "div"
                 ],
        "roles":  [
                      "tablist"
                  ],
        "anyInteractive":  false,
        "sampleLabel":  "Designer sections"
    },
    {
        "testId":  "agent-command-bar.title",
        "occurrences":  16,
        "surfaces":  [
                         "build.main",
                         "dialog.add.microsoft-iq",
                         "dialog.add-connected-agent",
                         "dialog.add-knowledge",
                         "dialog.add-knowledge.advanced",
                         "dialog.add-mcp-server",
                         "dialog.add-skill.blank",